{
  "key": "ACIFNAYouthLordsSupper",
  "slug": "acifnayouthlordssupper",
  "order": 9,
  "date": null,
  "platformName": "Zoom",
  "zoomInfo": {
    "language": "",
    "meetingId": "6477022625",
    "meetingPassword": "2625",
    "meetingLink": {
      "map": "https://us02web.zoom.us/j/F6477022625?pwd=bjVYMDh2ZUQwNTZzd1F0VVdmNldPZz09",
      "placeName": "Join the meeting by clicking on this link or using the details above in the zoom app"
    }
  },
  "imageUrl": "./acimaca_2021.png",
  "title": "ACIMCA 2021 - Virtual Youth Conference",
  "time": [
    {
      "id": 1,
      "date": {
        "day": "Friday",
        "date": "2",
        "sup": "nd",
        "month": "April"
      },
      "startTime": "17:00 CEST",
      "finishTime": " "
    },
    {
      "id": 1,
      "date": {
        "day": "Saturday",
        "date": "3",
        "sup": "rd",
        "month": "April"
      },
      "startTime": "16:00 CEST",
      "finishTime": " "
    },
    {
      "id": 1,
      "date": {
        "day": "Sunday",
        "date": "4",
        "sup": "th",
        "month": "April"
      },
      "startTime": "17:00 CEST",
      "finishTime": " "
    }
  ]
}