{
  "key": "ACIFNAYouth",
  "slug": "acifnayouth",
  "order": 3,
  "date": null,
  "platformName": "Zoom",
  "zoomInfo": {
    "language": "",
    "meetingId": "848 2692 3348",
    "meetingPassword": "acts02:38",
    "meetingLink": {
      "map": "https://us02web.zoom.us/j/84826923348?pwd=VmZHbzlpRGhLUXVNVXdyYm9BVThVUT09",
      "placeName": "Join the meeting by clicking on this link or using the meeting id above in the zoom app"
    }
  },
  "imageUrl": "./acifna_youth_thanksgiving.png",
  "title": "Digital ACIFNA Annual Youth Thanksgiving Conference",
  "time": [
    {
      "id": 1,
      "date": {
        "day": "Part 1 - Sunday",
        "date": "3",
        "sup": "rd",
        "month": "January"
      },
      "startTime": "16:00 CET",
      "finishTime": "20:00 CET"
    },
    {
      "id": 2,
      "date": {
        "day": "Part 2 - Sunday",
        "date": "3",
        "sup": "rd",
        "month": "January"
      },
      "startTime": "21:30 CET",
      "finishTime": "24:00 CET"
    }
  ]
}